{
  "$schema": "https://json-schema.org/draft/2020-12/schema",
  "$id": "urn:feynman:meta",
  "title": "Model metadata",
  "type": "object",
  "additionalProperties": false,
  "required": [
    "system",
    "summary",
    "source",
    "extraction"
  ],
  "properties": {
    "system": {
      "type": "string",
      "minLength": 1
    },
    "summary": {
      "type": "string",
      "minLength": 1
    },
    "source": {
      "type": "object",
      "additionalProperties": false,
      "required": [
        "repository",
        "commit"
      ],
      "properties": {
        "repository": {
          "type": "string"
        },
        "commit": {
          "type": "string",
          "pattern": "^[0-9a-f]{7,40}$"
        },
        "worktree": {
          "type": "boolean",
          "description": "The model describes the working tree on top of `commit`: the commit plus uncommitted changes, including untracked files."
        },
        "url": {
          "type": "string",
          "description": "Browsable repository URL."
        },
        "commitUrl": {
          "type": "string",
          "description": "Browsable URL of the modelled commit."
        },
        "fileUrl": {
          "type": "string",
          "description": "Browsable URL template for a file at the modelled commit; `{path}` is replaced by an anchor path."
        },
        "committedAt": {
          "type": "string",
          "format": "date-time"
        },
        "main": {
          "type": "object",
          "additionalProperties": false,
          "required": [
            "ref",
            "commit",
            "ahead",
            "behind",
            "checkedAt"
          ],
          "description": "Position of the modelled commit relative to the main branch when last measured.",
          "properties": {
            "ref": {
              "type": "string"
            },
            "commit": {
              "type": "string"
            },
            "ahead": {
              "type": "integer",
              "minimum": 0
            },
            "behind": {
              "type": "integer",
              "minimum": 0
            },
            "checkedAt": {
              "type": "string",
              "format": "date-time"
            }
          }
        },
        "footprint": {
          "$ref": "urn:feynman:common#/$defs/repositoryFootprint"
        },
        "base": {
          "type": "object",
          "additionalProperties": false,
          "required": [
            "commit"
          ],
          "description": "For an update: the previously modelled commit this model was updated from. Coverage then requires the files changed between base and commit.",
          "properties": {
            "commit": {
              "type": "string",
              "pattern": "^[0-9a-f]{7,40}$"
            }
          }
        }
      }
    },
    "extractedBy": {
      "type": "string"
    },
    "extraction": {
      "enum": [
        "bootstrap",
        "update"
      ],
      "description": "bootstrap: the first snapshot, covering every tracked file. update: edited from the model at meta.source.base, covering the files changed since."
    },
    "coverage": {
      "type": "string",
      "description": "What was and was not read in depth."
    },
    "extractedAt": {
      "type": "string",
      "format": "date-time"
    }
  },
  "description": "model/meta.json: what was modelled, from where, and how."
}
