{
  "system": "Axo",
  "summary": "Axo is a macOS terminal workspace for local agentic sessions, built around a SwiftUI application and a persistent Rust daemon that owns shell PTYs and session state, with optional remote access through a Cloudflare relay.",
  "source": {
    "repository": ".",
    "commit": "4b820700fafce7377352a0a1bcfe6d425279ae5d",
    "committedAt": "2026-10-25T03:16:48Z",
    "url": "https://github.com/leostera/axo",
    "commitUrl": "https://github.com/leostera/axo/commit/4b820700fafce7377352a0a1bcfe6d425279ae5d",
    "fileUrl": "https://github.com/leostera/axo/blob/4b820700fafce7377352a0a1bcfe6d425279ae5d/{path}",
    "main": {
      "ref": "main",
      "commit": "0ca6cf314eb3f1d1c6e45f282113fd5466e07157",
      "ahead": 0,
      "behind": 14,
      "checkedAt": "2026-10-25T05:09:54.232Z"
    },
    "footprint": {
      "files": 509,
      "lines": 87766,
      "excludes": [
        "vendor/",
        "third_party/",
        "*.lock",
        "package-lock.json",
        "*.lock.json"
      ]
    }
  },
  "extractedBy": "feynman",
  "extraction": "bootstrap"
}
